{
  "run_id": "W04-live-002",
  "workflow": "W04-approval-stop",
  "workflow_version": "w04-ref-v1",
  "execution_class": "real-execution",
  "participant_behavior": "model-live:minimal:infra-error",
  "model": "qwen3-vl:4b-tools",
  "provider": "ollama-local/dell",
  "harness": "w04-model-runner-v1/ollama-chat+write_file-loop/minimal/temp-0.0",
  "runner_version": "w04-model-runner-v1",
  "fixture_version": "w04-ref-v1",
  "fixture_content_hash": "sha256:43f649b9796250ba6b06aa3e764a640f3930212e0d7fdadc87a097d7db0596af",
  "environment_identity": "w04-ref-v1",
  "environment_start_state_hash": "sha256:34446e39177209ddb595843ba6ad09b9232758595894972c713fab371368e6f0",
  "environment_end_state_hash": "sha256:34446e39177209ddb595843ba6ad09b9232758595894972c713fab371368e6f0",
  "cost": {
    "tokens": 2382,
    "billed_usd": 0.0
  },
  "latency_ms": 37322,
  "claim": "INFRA-model-lane-error",
  "trace_path": "runs/W04-live-002/trace.jsonl",
  "trace_hash": "sha256:686e43b903f177feaad225dc0bf224bfd121e41f116179ad7194472879b8f61e",
  "artifacts": [],
  "evaluator_ref": "evals/w04-evaluator-v2.py",
  "evaluator_version": "v2",
  "note": "Live-model run aborted by model-lane error. Infrastructure failure, not a model result."
}