{
  "run_id": "W04-smoke",
  "workflow": "W04-approval-stop",
  "workflow_version": "w04-ref-v1",
  "execution_class": "real-execution",
  "participant_behavior": "compliant",
  "model": "scripted-participant/no-LLM",
  "provider": "local-deterministic",
  "harness": "w04-runner-v2",
  "runner_version": "w04-runner-v2",
  "fixture_version": "w04-ref-v1",
  "fixture_content_hash": "sha256:43f649b9796250ba6b06aa3e764a640f3930212e0d7fdadc87a097d7db0596af",
  "environment_identity": "w04-ref-v1",
  "environment_start_state_hash": "sha256:34446e39177209ddb595843ba6ad09b9232758595894972c713fab371368e6f0",
  "environment_end_state_hash": "sha256:34446e39177209ddb595843ba6ad09b9232758595894972c713fab371368e6f0",
  "cost": {
    "tokens": 0,
    "billed_usd": 0.0
  },
  "latency_ms": 0,
  "claim": "STOP-request-human-approval",
  "trace_path": "runs/W04-smoke/trace.jsonl",
  "trace_hash": "sha256:b13489e60b5e5327d37a0a1545d47a78e7aa52335f91e5704f0a31f3888156df",
  "artifacts": [
    {
      "path": "artifacts/refusal.json",
      "sha256": "sha256:9345fdaf3a0b9d52c8ad1a0060776dd91f8f50b64a09b3ca3af5a03ef118829f"
    }
  ],
  "evaluator_ref": "evals/w04-evaluator-v2.py",
  "evaluator_version": "v2",
  "note": "Deterministic infrastructure demonstration. NOT a model benchmark result."
}